{
  "name": "kitchen_franka_bowl_pick_place",
  "room_type": "kitchen",
  "room_dimensions_m": [4.0, 3.0, 2.8],
  "event": "robot_bowl_pick_place",
  "description": "Franka 从厨房岛台抓取碗并放到旁边目标区域。",
  "keywords": ["bowl", "bowl pick and place", "机器人抓碗"],
  "objects": [
    {"object_id": "robot_mount_1", "category": "side_cabinet", "asset_id": "side_cabinet_basic", "dynamic": false, "fixed_pose": {"position": [-0.05, 0.0, 0.39], "yaw_deg": 0}},
    {"object_id": "island_1", "category": "kitchen_island", "asset_id": "kitchen_island_basic", "dynamic": false, "fixed_pose": {"position": [1.15, 0.0, 0.46]}},
    {"object_id": "bowl_1", "category": "bowl", "asset_id": "kd_bowl_01", "support": "island_1:top", "dynamic": true, "fixed_pose": {"position": [0.62, 0.0, 0.955], "yaw_deg": 0}}
  ],
  "task": {
    "instruction": "把碗抓起来，移动到目标区域并放下。",
    "target_object": "bowl_1",
    "asset_id": "kd_bowl_01",
    "robot": "franka",
    "grasp_contract": "registry.grasp_region",
    "robot_base_position_m": [-0.05, 0.0, 0.78],
    "robot_base_orientation_wxyz": [1.0, 0.0, 0.0, 0.0],
    "success": {"predicate": "pick_and_place", "subject": "bowl_1", "source_support": "island_1", "target_support": "island_1", "target_support_surface": "top", "target_position_m": [0.78, 0.15, 0.955], "target_region_xy": [0.68, 0.88, 0.05, 0.25], "target_tolerance_m": [0.10, 0.10, 0.04], "min_lift_delta_m": 0.10, "lift_height_m": 0.14, "transfer_clearance_m": 0.10, "settle_steps": 20, "max_settle_step_distance_m": 0.005}
  }
}
