{
  "name": "living_room_returned_home",
  "room_type": "living_room",
  "room_dimensions_m": [5.2, 4.0, 2.8],
  "event": "returned_home",
  "description": "刚回到家，背包和鞋留在入口附近，钥匙放在长凳上。",
  "keywords": ["回家", "进门", "背包", "鞋", "钥匙", "returned home", "entry"],
  "objects": [
    {
      "object_id": "sofa_1",
      "category": "sofa",
      "dynamic": false,
      "fixed_pose": {"position": [-1.35, 1.25, 0.45], "yaw_deg": 0}
    },
    {
      "object_id": "coffee_table_1",
      "category": "coffee_table",
      "dynamic": false,
      "fixed_pose": {"position": [-0.85, 0.10, 0.21], "yaw_deg": -4}
    },
    {
      "object_id": "entry_bench_1",
      "category": "entry_bench",
      "dynamic": false,
      "fixed_pose": {"position": [1.85, -1.55, 0.23], "yaw_deg": 0}
    },
    {
      "object_id": "backpack_1",
      "category": "backpack",
      "support": "floor",
      "region_xy": [1.20, 2.25, -1.80, -0.70],
      "yaw_range_deg": [-55, 55]
    },
    {
      "object_id": "shoe_1",
      "category": "shoe",
      "support": "floor",
      "region_xy": [0.85, 2.30, -1.85, -0.55],
      "yaw_range_deg": [-80, 80],
      "relations": [
        {"kind": "near", "target": "backpack_1", "min_distance_m": 0.25, "max_distance_m": 0.75}
      ]
    },
    {
      "object_id": "keys_1",
      "category": "keys",
      "support": "entry_bench_1:top",
      "edge_bias": true,
      "yaw_range_deg": [-90, 90]
    }
  ],
  "task": {
    "instruction": "拿起入口长凳上的钥匙。",
    "target_object": "keys_1",
    "success": {"predicate": "lifted", "min_height_delta_m": 0.08}
  }
}

